{
 "schema": "csf-gap-analyst/2",
 "function": "RS",
 "round": 3,
 "categories": [
  {
   "categoryId": "RS.MA",
   "keyMessage": {
    "found": "Incidents run on improvisation with no tested plan, playbook, severity scale, or record.",
    "closes": "Approve an incident response plan with a ransomware playbook and hold a first tabletop exercise."
   },
   "whatWorksToday": "Users can report suspicious email with one click.",
   "strengths": [
    {
     "id": "STR-RS.MA-02",
     "type": "Foundation",
     "statement": "Users can report suspicious email with one click.",
     "evidence": [
      "EML-04"
     ]
    }
   ],
   "gapFindings": [
    {
     "id": "GAP-RS.MA-01",
     "basis": "Observed",
     "confidence": null,
     "title": "No tested incident response plan or ransomware playbook",
     "statement": "Incidents are handled by whoever is available, with no confirmed playbook, no exercise, and no criteria to start recovery.",
     "supportingFacts": [
      {
       "fact": "Playbooks for ransomware and phishing were not confirmed.",
       "evidence": [
        "IR-01"
       ]
      },
      {
       "fact": "No technical or tabletop exercise has been run.",
       "evidence": [
        "IR-04"
       ]
      },
      {
       "fact": "Criteria for starting recovery are not defined.",
       "evidence": [
        "RS.MA-05"
       ]
      }
     ],
     "extent": {
      "confirmed": [
       "Both hospitals"
      ],
      "likely": [],
      "notChecked": "Departmental downtime procedures were not collected"
     },
     "linkedSubcategories": [
      "RS.MA-01",
      "RS.MA-05"
     ],
     "evidence": [
      "IR-01",
      "IR-04",
      "RS.MA-05"
     ],
     "rootCause": [
      "Ownership",
      "Skills"
     ],
     "consequence": "Decisions in the first hours are improvised during an attack on a hospital that runs around the clock, and reporting duties are missed.",
     "likelihood": {
      "value": 4,
      "anchor": "L4-b",
      "rationale": "No tested plan exists and the threat is active.",
      "evidence": [
       "IR-01",
       "IR-04",
       "RS.MA-05"
      ]
     },
     "impact": {
      "ops": {
       "value": 5,
       "rationale": "Improvised response stops or slows hospital operations."
      },
      "fin": {
       "value": 4,
       "rationale": "Improvised response adds recovery cost and revenue loss."
      },
      "legal": {
       "value": 4,
       "rationale": "Improvised response triggers reporting duties or regulator questions."
      },
      "rep": {
       "value": 4,
       "rationale": "Improvised response damages patient and public trust."
      },
      "safety": {
       "value": 5,
       "rationale": "Improvised response delays or disrupts patient care."
      },
      "data": {
       "value": 4,
       "rationale": "Improvised response exposes sensitive health records."
      }
     },
     "responses": {
      "fix": [
       "IMP-RS.MA-01-01"
      ],
      "find": [],
      "prevent": [
       "IMP-RS.MA-01-02"
      ],
      "exceptions": [],
      "notApplicable": {
       "find": "The affected systems or units are already identified.",
       "exceptions": "No system is known to be unable to meet the control."
      }
     }
    },
    {
     "id": "GAP-RS.MA-02",
     "basis": "Observed",
     "confidence": null,
     "title": "Incident reports are not triaged, categorized, or escalated",
     "statement": "Reports reach IT but no steps triage, rate, or escalate them, so serious incidents cannot be told from routine ones.",
     "supportingFacts": [
      {
       "fact": "Users can report phishing with one click, but no triage steps follow.",
       "evidence": [
        "EML-04",
        "RS.MA-02"
       ]
      },
      {
       "fact": "The contact list and out-of-band channel are only partly defined.",
       "evidence": [
        "IR-05"
       ]
      },
      {
       "fact": "No severity scale categorizes incidents.",
       "evidence": [
        "RS.MA-03",
        "RS.MA-04"
       ]
      }
     ],
     "extent": {
      "confirmed": [
       "IT operations"
      ],
      "likely": [],
      "notChecked": "Past incident emails were not collected"
     },
     "linkedSubcategories": [
      "RS.MA-02",
      "RS.MA-03",
      "RS.MA-04"
     ],
     "evidence": [
      "EML-04",
      "RS.MA-02",
      "IR-05",
      "RS.MA-03",
      "RS.MA-04"
     ],
     "rootCause": [
      "Ownership"
     ],
     "consequence": "A reportable event passes as routine, and CMC misses its CII reporting duty.",
     "likelihood": {
      "value": 3,
      "anchor": "L3-c",
      "rationale": "Process gap that needs a reportable event before harm.",
      "evidence": [
       "EML-04",
       "RS.MA-02",
       "IR-05"
      ]
     },
     "impact": {
      "ops": {
       "value": 3,
       "rationale": "Missed reportable event stops or slows hospital operations."
      },
      "fin": {
       "value": 2,
       "rationale": "Limited direct effect in this scenario."
      },
      "legal": {
       "value": 3,
       "rationale": "Missed reportable event triggers reporting duties or regulator questions."
      },
      "rep": {
       "value": 2,
       "rationale": "Limited direct effect in this scenario."
      },
      "safety": {
       "value": 2,
       "rationale": "Limited direct effect in this scenario."
      },
      "data": {
       "value": 2,
       "rationale": "Limited direct effect in this scenario."
      }
     },
     "responses": {
      "fix": [
       "IMP-RS.MA-02-01",
       "IMP-RS.MA-02-02"
      ],
      "find": [],
      "prevent": [],
      "exceptions": [],
      "notApplicable": {
       "find": "The affected systems or units are already identified.",
       "prevent": "Recurrence is addressed by the related Governance and Process actions.",
       "exceptions": "No system is known to be unable to meet the control."
      }
     }
    }
   ],
   "observations": []
  },
  {
   "categoryId": "RS.AN",
   "keyMessage": {
    "found": "Investigations end at service restoration, and CMC cannot scope a breach to patient records.",
    "closes": "Define evidence steps, retain a forensic provider, and extend log retention."
   },
   "whatWorksToday": "",
   "strengths": [],
   "gapFindings": [
    {
     "id": "GAP-RS.AN-01",
     "basis": "Observed",
     "confidence": null,
     "title": "Investigation records and evidence are not preserved",
     "statement": "CMC has only partial forensic capability and unsynchronized clocks, so evidence is weak and the entry point stays unknown.",
     "supportingFacts": [
      {
       "fact": "Forensic capability is only partly available.",
       "evidence": [
        "IR-03"
       ]
      },
      {
       "fact": "System clocks are not synchronized to a trusted source.",
       "evidence": [
        "LOG-03"
       ]
      },
      {
       "fact": "No steps exist to preserve incident data and its integrity.",
       "evidence": [
        "RS.AN-06",
        "RS.AN-07"
       ]
      }
     ],
     "extent": {
      "confirmed": [
       "Incident handling"
      ],
      "likely": [],
      "notChecked": "Past incident files were not provided"
     },
     "linkedSubcategories": [
      "RS.AN-06",
      "RS.AN-07"
     ],
     "evidence": [
      "IR-03",
      "LOG-03",
      "RS.AN-06",
      "RS.AN-07"
     ],
     "rootCause": [
      "Skills",
      "Budget"
     ],
     "consequence": "Attackers return through the same route after recovery, and CMC cannot support a regulator inquiry.",
     "likelihood": {
      "value": 3,
      "anchor": "L3-a",
      "rationale": "Investigation capability is Partial and the threat is active.",
      "evidence": [
       "IR-03",
       "LOG-03",
       "RS.AN-06"
      ]
     },
     "impact": {
      "ops": {
       "value": 4,
       "rationale": "Repeat entry stops or slows hospital operations."
      },
      "fin": {
       "value": 3,
       "rationale": "Repeat entry adds recovery cost and revenue loss."
      },
      "legal": {
       "value": 3,
       "rationale": "Repeat entry triggers reporting duties or regulator questions."
      },
      "rep": {
       "value": 3,
       "rationale": "Repeat entry damages patient and public trust."
      },
      "safety": {
       "value": 2,
       "rationale": "Limited direct effect in this scenario."
      },
      "data": {
       "value": 3,
       "rationale": "Repeat entry exposes sensitive health records."
      }
     },
     "responses": {
      "fix": [
       "IMP-RS.AN-01-02"
      ],
      "find": [],
      "prevent": [
       "IMP-RS.AN-01-01"
      ],
      "exceptions": [],
      "notApplicable": {
       "find": "The affected systems or units are already identified.",
       "exceptions": "No system is known to be unable to meet the control."
      }
     }
    },
    {
     "id": "GAP-RS.AN-02",
     "basis": "Inferred",
     "confidence": "Medium",
     "title": "CMC cannot estimate how much patient data an incident reached",
     "statement": "Missing logs and data maps probably prevent CMC from scoping a breach to specific patient records.",
     "supportingFacts": [
      {
       "fact": "HIS and PACS produce no security logs.",
       "evidence": [
        "F6:HIS",
        "F6:PACS"
       ]
      },
      {
       "fact": "No data inventory supports scoping.",
       "evidence": [
        "ID.AM-07"
       ]
      },
      {
       "fact": "Incident magnitude is not estimated or validated.",
       "evidence": [
        "RS.AN-08"
       ]
      }
     ],
     "extent": {
      "confirmed": [
       "HIS",
       "PACS"
      ],
      "likely": [
       "LIS",
       "ERP"
      ],
      "notChecked": "Application audit logs were not reviewed"
     },
     "linkedSubcategories": [
      "RS.AN-03",
      "RS.AN-08"
     ],
     "evidence": [
      "F6:HIS",
      "F6:PACS",
      "ID.AM-07",
      "RS.AN-08"
     ],
     "rootCause": [